{
  "schema_version": "2.0",
  "name": "review a proposed service configuration replacement",
  "summary": "Review a proposed deployment contract; NetOps 0.2.0 will not execute it.",
  "host_alias": "edge-a",
  "invariants": [
    "SSH remains reachable",
    "The host default route is unchanged",
    "Existing unrelated listeners remain available"
  ],
  "backup_paths": [
    "/etc/example/service.json"
  ],
  "backup_root": "/var/backups/netops",
  "control_channel": {
    "dependency": "independent",
    "change_surfaces": [
      "remote-proxy-service"
    ],
    "continuity_strategy": "independent-path",
    "independent_path_verified": true,
    "operator_recovery_reviewed": true,
    "host_reboot_planned": false,
    "evidence": [
      "The management connection was verified through a path that does not use this service."
    ]
  },
  "rollback_timer": {
    "enabled": false,
    "delay_seconds": 600
  },
  "payloads": [
    {
      "local_path": "payload/service.json",
      "remote_path": "/etc/example/service.json",
      "mode": "0640"
    }
  ],
  "operations": [
    {
      "phase": "preflight",
      "description": "Confirm the target configuration exists",
      "check": "file-sha256",
      "target": "/etc/example/service.json",
      "sha256": "0000000000000000000000000000000000000000000000000000000000000000",
      "metadata_sha256": "1111111111111111111111111111111111111111111111111111111111111111"
    },
    {
      "phase": "preflight",
      "description": "Confirm the service unit exists",
      "check": "service-exists",
      "target": "example.service"
    },
    {
      "phase": "validate",
      "description": "Validate the prepared configuration",
      "command": "/usr/local/bin/example-service check /etc/example/service.json"
    },
    {
      "phase": "verify",
      "description": "Verify the service is active after restart",
      "command": "systemctl is-active --quiet example.service"
    },
    {
      "phase": "rollback",
      "description": "Reload unit metadata after the built-in backup restore",
      "command": "systemctl daemon-reload"
    },
    {
      "phase": "rollback_verify",
      "description": "Verify the restored service is active",
      "command": "systemctl is-active --quiet example.service"
    }
  ],
  "restart_services": [
    "example.service"
  ]
}
